{"contract":"setup-context-observation","schemaVersion":2,"requestId":"request-synthetic","asOf":"2026-10-17T08:00:00+00:00","data":{"observationId":"observation-synthetic","setupId":"setup-synthetic","revision":1,"source":"manual","effectiveAtUtc":"2026-10-17T08:00:00+00:00","sessionVersionIds":["session-version-synthetic"],"marketConditionRevisionIds":["condition-revision-synthetic"],"contentHash":"0d850e61b3b1ae7bca3f3a2745b1ac07b81440cb34b1952341bc161da608eb1c","publicationSequence":4,"knownAtUtc":"2026-10-17T08:00:00+00:00"}}
